{
  "$schema": "https://json-schema.org/draft/2020-12/schema",
  "$id": "https://recruitment-system.local/contracts/events/application-events.v1.schema.json",
  "title": "Recruitment Application Event v1",
  "description": "Versioned event emitted by Application Service. The Kafka key is the canonical application_id and aggregate_version identifies the resulting Application state.",
  "type": "object",
  "additionalProperties": false,
  "required": [
    "schema_version",
    "event_id",
    "action",
    "application_id",
    "job_id",
    "job_title",
    "candidate_id",
    "recruiter_id",
    "actor_id",
    "from_status",
    "to_status",
    "aggregate_version",
    "occurred_at"
  ],
  "properties": {
    "schema_version": {
      "const": 1
    },
    "event_id": {
      "type": "string",
      "pattern": "^[0-9a-f]{8}-[0-9a-f]{4}-[1-5][0-9a-f]{3}-[89ab][0-9a-f]{3}-[0-9a-f]{12}$"
    },
    "action": {
      "enum": ["STATUS_CHANGED", "OFFER_SENT"]
    },
    "application_id": {
      "type": "string",
      "pattern": "^[0-9a-f]{8}-[0-9a-f]{4}-[1-5][0-9a-f]{3}-[89ab][0-9a-f]{3}-[0-9a-f]{12}$"
    },
    "job_id": {
      "type": "string",
      "pattern": "^[0-9a-f]{8}-[0-9a-f]{4}-[1-5][0-9a-f]{3}-[89ab][0-9a-f]{3}-[0-9a-f]{12}$"
    },
    "job_title": {
      "type": "string",
      "minLength": 1,
      "maxLength": 200,
      "pattern": "^[^\\u0000-\\u001f\\u007f]+$"
    },
    "candidate_id": {
      "type": "string",
      "pattern": "^[0-9a-f]{8}-[0-9a-f]{4}-[1-5][0-9a-f]{3}-[89ab][0-9a-f]{3}-[0-9a-f]{12}$"
    },
    "recruiter_id": {
      "type": "string",
      "pattern": "^[0-9a-f]{8}-[0-9a-f]{4}-[1-5][0-9a-f]{3}-[89ab][0-9a-f]{3}-[0-9a-f]{12}$"
    },
    "actor_id": {
      "oneOf": [
        {
          "type": "string",
          "pattern": "^[0-9a-f]{8}-[0-9a-f]{4}-[1-5][0-9a-f]{3}-[89ab][0-9a-f]{3}-[0-9a-f]{12}$"
        },
        {
          "type": "null"
        }
      ]
    },
    "from_status": {
      "oneOf": [
        {
          "$ref": "#/$defs/application_status"
        },
        {
          "type": "null"
        }
      ]
    },
    "to_status": {
      "$ref": "#/$defs/application_status"
    },
    "aggregate_version": {
      "type": "integer",
      "minimum": 0,
      "maximum": 9007199254740991
    },
    "occurred_at": {
      "type": "string",
      "maxLength": 40,
      "pattern": "^\\d{4}-\\d{2}-\\d{2}T\\d{2}:\\d{2}:\\d{2}(?:\\.\\d{1,9})?Z$"
    },
    "offer_id": {
      "type": "string",
      "pattern": "^[0-9a-f]{8}-[0-9a-f]{4}-[1-5][0-9a-f]{3}-[89ab][0-9a-f]{3}-[0-9a-f]{12}$"
    },
    "offer_status": {
      "enum": ["SENT", "ACCEPTED", "DECLINED"]
    },
    "offer_version": {
      "type": "integer",
      "minimum": 0,
      "maximum": 9007199254740991
    }
  },
  "dependentRequired": {
    "offer_id": ["offer_status", "offer_version"],
    "offer_status": ["offer_id", "offer_version"],
    "offer_version": ["offer_id", "offer_status"]
  },
  "allOf": [
    {
      "if": {
        "properties": {
          "action": {
            "const": "OFFER_SENT"
          }
        },
        "required": ["action"]
      },
      "then": {
        "required": ["offer_id", "offer_status", "offer_version"],
        "properties": {
          "from_status": {
            "const": "INTERVIEW"
          },
          "to_status": {
            "const": "OFFER"
          },
          "offer_status": {
            "const": "SENT"
          }
        }
      }
    },
    {
      "if": {
        "allOf": [
          {
            "properties": {
              "action": {
                "const": "STATUS_CHANGED"
              }
            },
            "required": ["action"]
          },
          {
            "required": ["offer_id"]
          }
        ]
      },
      "then": {
        "properties": {
          "from_status": {
            "const": "OFFER"
          }
        },
        "oneOf": [
          {
            "required": ["offer_status", "to_status"],
            "properties": {
              "offer_status": { "const": "ACCEPTED" },
              "to_status": { "const": "HIRED" }
            }
          },
          {
            "required": ["offer_status", "to_status"],
            "properties": {
              "offer_status": { "const": "DECLINED" },
              "to_status": { "const": "REJECTED" }
            }
          }
        ]
      }
    }
  ],
  "$defs": {
    "application_status": {
      "type": "string",
      "enum": [
        "APPLIED",
        "REVIEWING",
        "INTERVIEW",
        "OFFER",
        "HIRED",
        "REJECTED",
        "WITHDRAWN"
      ]
    }
  }
}
