{
  "schema_version": 1,
  "event_id": "11111111-1111-4111-8111-111111111114",
  "action": "STATUS_CHANGED",
  "application_id": "22222222-2222-4222-8222-222222222222",
  "job_id": "33333333-3333-4333-8333-333333333333",
  "job_title": "Backend Engineer",
  "candidate_id": "44444444-4444-4444-8444-444444444444",
  "recruiter_id": "55555555-5555-4555-8555-555555555555",
  "actor_id": "44444444-4444-4444-8444-444444444444",
  "from_status": "OFFER",
  "to_status": "HIRED",
  "aggregate_version": 6,
  "occurred_at": "2026-08-28T10:00:01Z",
  "offer_id": "66666666-6666-4666-8666-666666666666",
  "offer_status": "ACCEPTED",
  "offer_version": 1
}
